,Artist,Lyrics,Key,Genre,Music,Song,Title,Visits,title-en
0,"ශ්‍රීමතී තිලකරත්න, වික්ටර් රත්නායක",ආදරණීය දිනය ඇල්විස්,Key,"ඩුවට්ස්, ගෝල්ඩන් ඕල්ඩීස්",වික්ටර් රත්නායක,ආදර ගඟුලෙහි ඉවුරෙ රැඳී සහන පවන් සැලූ මා ළඟ ඔබ සිටිනා විටදී ලොවම දැකුම්කලු // මල් වැල් වන විල් පිරී ගියේ සෙවණ දෙවන්නලු බිඟු නඳ විහඟුන් ඉගිල්ලුනේ මිහිරෙ රැඳෙන්නලු පුන් සඳ නැගුනෙත් අහස් තලේ අපට බලන්නලු දෙනෙතට කඳුලැලි තුරුල් කලේ පෙමට අඬන්නලු පෙමට අඬන්නලු මී වද මී පැණි පිරී ගියේ දෙතොලෙ රඳන්නලු දේදුනු ඕවිලි මැවී ගියේ ලොවම පිනන්නලු මේ ලොව මා ඉපදුනේ ප්‍රියේ ඔබව ලබන්නලු ඒ හැර ලැබුණත් පලක් නැතේ ඉසුරු මැණික් මලු ඉසුරු මැණික් මලු,ආදර ගඟුලෙහි,3906,adara gangulehi
1,ප්‍රියා සූරියසේන,ආදරණීය දිනය ඇල්විස්,A major,නව පොප්,ප්‍රියා සූරියසේන,ආදරණීය නේරංජනා - ආදරණීය නේරංජනා ආදරණීය නේරංජනා - ආදරණීය නේරංජනා ආදරණීය නේරංජනා - ආදරණීය නේරංජනා ඔබ මුදු මදහස් රැළි මාලාවේ වෙලී බැදුණු දින රඟ ශාලාවේ තුන් හිතකින්වත් නොසිතූ විලසින් යළි ඔබ දැකුමට ආ වේලාවේ අප හමු වූ ගෙවුයන් සීමාවේ එක මොහොතක් පමණකි තනි වූයේ මටම ම පුදුමයි අදහන්නට බෑ මම ම නොවේ යළි ඉන් පිට වූයේ කවුදෝ මා පසු පස එනු දැනුණා පාළු වීදියේ තනිකම මැකුණා ජීවමාන කිසිවකු සිටියේ නෑ එනමුදු කවුදෝ ඇති බව වැකුණා නිදියහනේ මා නින්දට වැටුණා ඔබ මා සිහිනෙන් අමතනු පෙනුණා එනමුදු කෙලෙසද ඇගේ අත ගන්නේ මගේ සිතම මට මුමුණනු ඇසුනා,ආදරණීය නේරංජනා,3277,adaraneeya neranjana
2,වික්ටර් රත්නායක,ආදරණීය දිනය ඇල්විස්,Key,"ක්ලැසික්, දේවානුභාවයෙන්",වික්ටර් රත්නායක,ආදරයේ උල්පත වූ අම්මා මා ඔබගේ පුතු වූ…. ඔබ මතු බුදුවන දවසේ මා රාහුල කුමරුන් සේ සෙවන පතා අද මෙන් පැමිණෙන්නෙමි සුළැගිල්ලේ එල්ලී සඳ දිය කොට කිරිවතුරෙන් ඒ දියරෙන් මුව දෝවා දිව මතුරක්වන් නැලැවිලි ගීයෙන් මතකයි මා නැලැවූවා ජීවිතයෙන් ජීවිතයක් ගෙන දී ඒ ජීවිතයට කිරි දී පණ දී මා දැඩි කල අම්මා තුරුලට ගෙන අත් පා හැඩ ගස්වා නිදි ගන්වා යහන් ගැබේ සිහිනෙන් ගෑ සුවඳක් මෙන් සිහිවෙයි ඒ කිරි සුවඳ ඔබේ දවසින් දවසට සෙනෙහස ලබැදී ගෙන දී දිවියට නව පන ලැබදී මා දැඩි කල අම්මා,ආදරයේ උල්පත වූ,5052,adaraye ulpatha wu
3,මර්වින් පෙරෙයිරා,ආදරණීය දිනය ඇල්විස්,Key,පැරණි පොප්ස්,මර්වින් පෙරෙයිරා,අකුරු සතරකින් මනස පැටලිලා වැලි පිල්ලේ ලිය ලියා ගළපන්න ට බැරිව ළතැ වුණා ආදරයයි අකුරු සතර ඒ// ආ යන්නෙන් මා පැතු ආදරේ ද යනු ගිනි තියාලා දව දවා ගින්දරේ ර යනු රළු බැවින් සවන් යුග වසා ය යනු කීවේ යන්න ඔබ හැරා වි යනු වියෝගේ මැව්වා සිතේ වා යනු වාවන්න ට පෙළඹුවා නිරතුරේ හ යනු හසරැළී නගන්නෙමි කියා ය යනු යළි කීවේ එන්න ඔබ කරා,අකුරු සතරකින්,969,akuru satharakin
4,වික්ටර් රත්නායක,ආදරණීය දිනය ඇල්විස්,C major | Beat,චිත්‍රපට ගීත,වික්ටර් රත්නායක,අඳුර බිඳින්නට රැයක් දවාලු ලන්තෑරුම් නිවලා තිමිරයෙ තිරකඩ අරුණෙහි බිඳහැර හිරු තව දවසක් ගෙනැවිල්ලා// මතකය නම් වූ මළපොත පෙරලා මළගිය ඊයේ සිහිපත් කළ මැන පැතූ පැතුම් අත් මිට මොලවාගත් දෑතෙහි දසැඟිලි දිගහැරලනු මැන එහි මොනවද ඇත්තේ කිසිත් නැත හිස් බවෙකිය ඇත්තේ සමුදුර ගිරිහෙල් දෙරණ තලා මැද යෞවන විය පියවර තබනා සඳ හිස්වන හදවිත සපුරා ලන්නට මියැසි විරාමය යළි පැමිණි ඇත අරුමෙකි පැවසෙන්නේ එපමණයි පිළිසරණය වන්නේ,අඳුර බිඳින්නට,1806,andura bidinnata
5,වික්ටර් රත්නායක,ආදරණීය දිනය ඇල්විස්,Key,ගෝල්ඩන් ඕල්ඩීස්,වික්ටර් රත්නායක,අපි හැඟුම් වලට ඉඩදී මොහොතක්‌ ඉඩ ලබාගනිමු තරමින් වියතක්‌ හඳ පානේ මද අඳුරේ අත් පටලා යමු ආයේ අත් පටලා යමු ආයේ ඔබ ඔබෙ හෙවණැල්ලෙන් මිදී මම මගෙ හෙවණැල්ලෙන් මිදී// අවුදින් හිමින් රහසින් මුමුණා හඳ පානේ මද අඳුරේ හඳ පානේ මද අඳුරේ…… හිරකර හසරැල්ලෙන් හැඩුම් අපි හිනැහෙමු සපුරා පැතුම්// මතු ආත්මයේ හමුවෙන පැතුමින් යමු වෙන්වී හිමිදිරියේ හඳ පානේ මද අඳුරේ……,අපි හැඟුම් වලට,20041,api hangum walata
6,"ශ්‍රීමතී තිලකරත්න, වික්ටර් රත්නායක",ආදරණීය දිනය ඇල්විස්,Key,"ඩුවට්ස්, ගෝල්ඩන් ඕල්ඩීස්",වික්ටර් රත්නායක,ආදර ගඟුලෙහි ඉවුරෙ රැඳී සහන පවන් සැලූ මා ළඟ ඔබ සිටිනා විටදී ලොවම දැකුම්කලු // මල් වැල් වන විල් පිරී ගියේ සෙවණ දෙවන්නලු බිඟු නඳ විහඟුන් ඉගිල්ලුනේ මිහිරෙ රැඳෙන්නලු පුන් සඳ නැගුනෙත් අහස් තලේ අපට බලන්නලු දෙනෙතට කඳුලැලි තුරුල් කලේ පෙමට අඬන්නලු පෙමට අඬන්නලු මී වද මී පැණි පිරී ගියේ දෙතොලෙ රඳන්නලු දේදුනු ඕවිලි මැවී ගියේ ලොවම පිනන්නලු මේ ලොව මා ඉපදුනේ ප්‍රියේ ඔබව ලබන්නලු ඒ හැර ලැබුණත් පලක් නැතේ ඉසුරු මැණික් මලු ඉසුරු මැණික් මලු,ආදර ගඟුලෙහි,3906,adara gangulehi
7,ප්‍රියා සූරියසේන,ආදරණීය දිනය ඇල්විස්,A major,නව පොප්,ප්‍රියා සූරියසේන,ආදරණීය නේරංජනා - ආදරණීය නේරංජනා ආදරණීය නේරංජනා - ආදරණීය නේරංජනා ආදරණීය නේරංජනා - ආදරණීය නේරංජනා ඔබ මුදු මදහස් රැළි මාලාවේ වෙලී බැදුණු දින රඟ ශාලාවේ තුන් හිතකින්වත් නොසිතූ විලසින් යළි ඔබ දැකුමට ආ වේලාවේ අප හමු වූ ගෙවුයන් සීමාවේ එක මොහොතක් පමණකි තනි වූයේ මටම ම පුදුමයි අදහන්නට බෑ මම ම නොවේ යළි ඉන් පිට වූයේ කවුදෝ මා පසු පස එනු දැනුණා පාළු වීදියේ තනිකම මැකුණා ජීවමාන කිසිවකු සිටියේ නෑ එනමුදු කවුදෝ ඇති බව වැකුණා නිදියහනේ මා නින්දට වැටුණා ඔබ මා සිහිනෙන් අමතනු පෙනුණා එනමුදු කෙලෙසද ඇගේ අත ගන්නේ මගේ සිතම මට මුමුණනු ඇසුනා,ආදරණීය නේරංජනා,3277,adaraneeya neranjana
8,වික්ටර් රත්නායක,ආදරණීය දිනය ඇල්විස්,Key,"ක්ලැසික්, දේවානුභාවයෙන්",වික්ටර් රත්නායක,ආදරයේ උල්පත වූ අම්මා මා ඔබගේ පුතු වූ…. ඔබ මතු බුදුවන දවසේ මා රාහුල කුමරුන් සේ සෙවන පතා අද මෙන් පැමිණෙන්නෙමි සුළැගිල්ලේ එල්ලී සඳ දිය කොට කිරිවතුරෙන් ඒ දියරෙන් මුව දෝවා දිව මතුරක්වන් නැලැවිලි ගීයෙන් මතකයි මා නැලැවූවා ජීවිතයෙන් ජීවිතයක් ගෙන දී ඒ ජීවිතයට කිරි දී පණ දී මා දැඩි කල අම්මා තුරුලට ගෙන අත් පා හැඩ ගස්වා නිදි ගන්වා යහන් ගැබේ සිහිනෙන් ගෑ සුවඳක් මෙන් සිහිවෙයි ඒ කිරි සුවඳ ඔබේ දවසින් දවසට සෙනෙහස ලබැදී ගෙන දී දිවියට නව පන ලැබදී මා දැඩි කල අම්මා,ආදරයේ උල්පත වූ,5052,adaraye ulpatha wu
9,මර්වින් පෙරෙයිරා,ආදරණීය දිනය ඇල්විස්,Key,පැරණි පොප්ස්,මර්වින් පෙරෙයිරා,අකුරු සතරකින් මනස පැටලිලා වැලි පිල්ලේ ලිය ලියා ගළපන්න ට බැරිව ළතැ වුණා ආදරයයි අකුරු සතර ඒ// ආ යන්නෙන් මා පැතු ආදරේ ද යනු ගිනි තියාලා දව දවා ගින්දරේ ර යනු රළු බැවින් සවන් යුග වසා ය යනු කීවේ යන්න ඔබ හැරා වි යනු වියෝගේ මැව්වා සිතේ වා යනු වාවන්න ට පෙළඹුවා නිරතුරේ හ යනු හසරැළී නගන්නෙමි කියා ය යනු යළි කීවේ එන්න ඔබ කරා,අකුරු සතරකින්,969,akuru satharakin
10,වික්ටර් රත්නායක,ආදරණීය දිනය ඇල්විස්,C major | Beat,චිත්‍රපට ගීත,වික්ටර් රත්නායක,අඳුර බිඳින්නට රැයක් දවාලු ලන්තෑරුම් නිවලා තිමිරයෙ තිරකඩ අරුණෙහි බිඳහැර හිරු තව දවසක් ගෙනැවිල්ලා// මතකය නම් වූ මළපොත පෙරලා මළගිය ඊයේ සිහිපත් කළ මැන පැතූ පැතුම් අත් මිට මොලවාගත් දෑතෙහි දසැඟිලි දිගහැරලනු මැන එහි මොනවද ඇත්තේ කිසිත් නැත හිස් බවෙකිය ඇත්තේ සමුදුර ගිරිහෙල් දෙරණ තලා මැද යෞවන විය පියවර තබනා සඳ හිස්වන හදවිත සපුරා ලන්නට මියැසි විරාමය යළි පැමිණි ඇත අරුමෙකි පැවසෙන්නේ එපමණයි පිළිසරණය වන්නේ,අඳුර බිඳින්නට,1806,andura bidinnata
11,වික්ටර් රත්නායක,ආදරණීය දිනය ඇල්විස්,Key,ගෝල්ඩන් ඕල්ඩීස්,වික්ටර් රත්නායක,අපි හැඟුම් වලට ඉඩදී මොහොතක්‌ ඉඩ ලබාගනිමු තරමින් වියතක්‌ හඳ පානේ මද අඳුරේ අත් පටලා යමු ආයේ අත් පටලා යමු ආයේ ඔබ ඔබෙ හෙවණැල්ලෙන් මිදී මම මගෙ හෙවණැල්ලෙන් මිදී// අවුදින් හිමින් රහසින් මුමුණා හඳ පානේ මද අඳුරේ හඳ පානේ මද අඳුරේ…… හිරකර හසරැල්ලෙන් හැඩුම් අපි හිනැහෙමු සපුරා පැතුම්// මතු ආත්මයේ හමුවෙන පැතුමින් යමු වෙන්වී හිමිදිරියේ හඳ පානේ මද අඳුරේ……,අපි හැඟුම් වලට,20041,api hangum walata
12,මිල්ටන් මල්ලවරාච්චි,ආදරණීය දිනය ඇල්විස්,A major,පැරණි පොප්ස්,ක්ලැරන්ස් විජේවර්ධන,අවසර නැත මට ඔබෙ අත ගන්නට බැමි බැඳ ඇත ලොව සතර දෙසේ එනමුදු උපදින හැම භවයකදිම මතු ඔබ හිමිකර ගනිමි ලඳේ බමරෙකු වන්නට නොහැකිව ලතවන මා අභියස ඔබ නෙළුම නොවේ උල්පත වන්නට නොහැකිව ලතවන මා අභියස ඔබ සයුර නොවේ ඔහු රිදවන්නට - ඔහු හඬවන්නට බැරිකම මිස ඔබෙ - සිහින ලොවේ ඔබ කැඳවන්නට - ඔබ සතපන්නට මා හද තුල ඉඩ නැතිව නොවේ,අවසර නැත මට,2459,awasara netha mata
13,ඇන්ජලින් ගුණතිලක,ආදරණීය දිනය ඇල්විස්,Key,පැරණි පොප්ස්,අර්නස්ට් සොයිසා,බංගලි වළලු ගෙන එන්නයි පොරොන්දුව දුහුලැල් සාරි ගෙන එන්නයි පොරොන්දුව රන් මිණි මාල පළඳන්නයි පොරොන්දුව එය ඉටු කෙරෙනා කල නාවද ඉතින් තව// යල මහ දෙක වැඩ කරලා ගොයම් කපා බක් මහ එන්න පෙර බැඳෙමුයි තැවෙන්නෙපා ඉක්මන් කතා කී ඇස් දෙක අඬන්නෙපා දැක්මත් සහනයකි ඔබ මගහරින්නෙපා දෙවැට දිරා ගිය රුක් අතු සෙවණ යට ඕවිට අසල දිය උතුරන පොකුණ පිට තාමත් දැණෙනවා ඇඟ ගෑ සුවඳ මට නවතිනු බැරි වුණත් එනු මස්සිනේ ගෙට,බංගලි වළලු,757,bangali walalu
14,අමරසිරි පීරිස්,ආදරණීය දිනය ඇල්විස්,Key,"සම්භාව්‍ය, ඉල්ලීම",අමරසිරි පියරිස්,චාරු දේහේ නුරා මා දෑසේ මැවේ රාත්‍රියේ රෑ සඳේ ඈ සිනා ශ්‍රීය දේ චාරු දේහේ නුරා පිහින පීනා රසෝගේ සරාගී විලේ රාත්‍රි යාමයේ// ඈගේ දෑසේ ප්‍රබෝධේ නුරා ගී නැගේ ජීවිතේ යෞවනේ ප්‍රේමයේ මී වනේ සීත මිහිදුම් වළාවෝ වෙළීලා සඳේ තාරකාවේ// මිහි තලාවේ තුසීතේ මැවේ මා හදේ ජීවිතේ යෞවනේ ප්‍රේමයේ මී වනේ,චාරු දේහේ නුරා,1713,charu dehe nura
15,මර්වින් පෙරෙයිරා,ආදරණීය දිනය ඇල්විස්,Key,පැරණි පොප්ස්,මර්වින් පෙරෙයිරා,දෙදෙනා පෙරදා හමුවී නොදොඩා නොබලා වෙන් වූ තැන් කරා ආයෙමත් පැමිණිලා// දෙදෙනා දිගු කාලයක් ගෙවී ගියේ එක මොහොතක් ලෙසින්නේ ළඳේ ඒ මොහොත දැන් දිගු කාලයක් ලෙස ආයෙත් ගෙනල්ලා තියේ අද මේ කියූ දේ ඊයේ වුණා නම් අද ඊයේ වේවී ළඳේ ඔබ ආදරෙන් සිනාසුනත් අද අලුතින් උපන් මේ ලොවේ විස ගෑවුනත් මධු පානයක් ලෙස ඈ මා ළඟින් මිහිරියේ අසනු සමා වී ආයේ පමාවී කිසිදාක නොයෙනූ ළඳේ,දෙදෙනා පෙරදා,1300,dedena perada
16,සුනිල් එඩිරිසිංහ,ආදරණීය දිනය ඇල්විස්,Key,පැරණි පොප්ස්,රොහාන වීරසිංහ,දෑවැදි දෙන්නට රන්මසු පොදි නැති ගෙදරට බර වුණු බාල නඟේ නුඹ ගෙනියන්නට ගමෙත් කෙනෙක් නැහැ රටෙත් කෙනෙක් නැහැ බාල නඟේ // විරසක වීලා විරහ අපලයෙන් නුඹෙ ඉරණම නුඹ ළඟට නොයේ නිදිබර දෑසයි දැලි ගෑ මුහුණයි ලිප මුල්ලේ යෞවනය ගෙවේ රන්දම් පැලඳිය යුතු ගෙල වටකර නවගුණ වැල පෝ දිනට බැඳේ දීගෙක ගියදා නුඹට දැනේවී තනිකඩකම කොච්චරද අගේ,දෑවැදි දෙන්නට,760,dewedi dennata
17,වික්ටර් රත්නායක,ආදරණීය දිනය ඇල්විස්,Key,"ගෝල්ඩන් ඕල්ඩීස්, දේවානුභාවයෙන්",වික්ටර් රත්නායක,දෙව්රම් වෙහෙරේ හිමි වැඩ සිටි සමයේ මා සිටියානම් සමිදුනි ඔබ පිළිසරණ පතා මම‍ එමි බවදුරු කතර ගෙවා සහසක් දොම්නස් දුක් ගිනි අතරේ දැවෙන මහද සිතිවිලි ගිණි අදුරේ සමිද ඔබේ පිළිරුව දුටු පමණින් නිවී නිවී යන අරුමය කිමදෝ ජීවමානවම හිමි දැක ගන්නට මා නෙත කල පින් මද බව වැටහිනි එහෙයින් හිමි අනුරුව අභියස සිට බවුන් වඩමි ‍මෙත් බුදුන් දකින්නට,දෙව්රම් වෙහෙරේ,1280,dewram wehere
18,මිල්ටන් මල්ලවරාච්චි,ආදරණීය දිනය ඇල්විස්,G major,පැරණි පොප්ස්,වික්ටර් රත්නායක,දිනෙක රන් සළු පළඳා සඳ නැගි මේලාවෙන් පැමින ඔබ ගෙනයමි කුමරියෙ පෙම් දෝලාවෙන් // ඇසුරු කළ කම්පන හා සැනසිලි පසමිතුරෑ ගෙවුනු යෙෳවන විය තනි නොතනියෙ උන් අයුරෑ නැවත නොලිහෙන ලෙස රැහැනින් බැඳ දා පවුරු සතුට ගෙන දිය හැකි ඔබ හැර ඇතිදෝ කවුරු වියලි මග මහ වැලි කාන්තාර පසු කරවා පවස සංසිඳවන ලෙස දිය උල්පත හරවා පරව ගිලිහෙන තුරු සියොළඟ කළු සළු පොරවා ඔබය දිය යුතු හිස් වන විට දිවි විත පුරවා,දිනෙක රන්සළු,1109,dineka ransalu
19,මර්වින් පෙරෙයිරා,ආදරණීය දිනය ඇල්විස්,Key,"ගෝල්ඩන් පොප්, ඉල්ලීම","අනුරාධ අබයාසිංහ, මර්වින් පෙරේරා",දියළුම දිය ඇලි දිය රැල හා ගල ගල යයි සමුදුර සොයලා හද උපදී ආදරේ සැනසුම් තෙර සොයලා// අද නැති දේ හෙට මා සොයයි හෙට හමු වී යළි ඈ සොයයි ඔබ හමුවේ හද ගී ගයයි ඔබ ඒ ගීතයෙ රාවයයි සසර පුරා ඇසු ගීතයේ රසයේ කිමිදී පැතුසේ සඳවත කුමටද ඔබ නැතිදා හිරු නැග පල නැත ඔබ නැතිදා සඳ හිරු හා ආදරේ මොකටද ඔබ නැති දා පියබර සිතුවිලි මතු අමුණයි සවණට සැනසිලි හඬ මුමුණයි කැළඹෙන මේ ලෝකයේ සහනය ඔබ පමණයි //,දියළුම දිය ඇලි,822,diyaluma diya eli
20,මිල්ටන් මල්ලවරාච්චි,ආදරණීය දිනය ඇල්විස්,A minor,පැරණි පොප්ස්,ක්ලැරන්ස් විජේවර්ධන,එදා රෑ ගුවන් තොටුපොලේ දී මා වෙන් වී ගියේ සිතකින් නොවේ නෑ සිය මිතුරන් පැමිනීලා ආසිරී සුභ පැතුම් පැතුවා ඔබ නාවෙ ඇයි මිහිරියේ මේ වන තුරු රහසක් වී ලා මා සිතේ යම් දෙයක් තිබුනා එය කීමටයි ලතැවුනේ,එදා රෑ,4082,eda rae
