,Artist,Lyrics,Key,Genre,Music,Song,Title,Visits,title-en
192,එම්.එස්. ප්‍රනාන්දු,එම්.එස්. ප්‍රනාන්දු,Key,"පැරණි පොප්ස්, ඉල්ලීම",ආර්.ඒ.චන්ද්‍රසේන,අවුදුරු පණස් තුනයි වයස බැලු බැල්මට කියන්න බෑ තාමත් කොල්ල වගේ ඉන්නේ හැට පැන්නත් නැකි වෙන්නෙ නෑ සුළු දෙයක්නෙ තවම ඔහෙල මේක දන්නෙ නෑ නාකි නොවී ඉන්න රහස හංග ගන්නෙ නෑ// කියල දෙන්න තෑගි බෝග ඕන වෙන්නෙ නෑ ලේසි පහසු දෙයක් නොවේ හිතුවොත් බැරි නෑ පුහු මැනෙන් ඉදිමුන සිත පිරිසිදු වෙන්නෑ අමනාපෙන් වෙන්වූ විට සිතට සතුට නෑ // සිතේ සතුට නැතිදා සැනසීම සිතට නෑ සිත පිරිසිදු අය කවදත් නාකි වෙන්නෙ නෑ,අවුදුරු පණස් තුනයි,3195,awurudu panas thunai
193,එම්.එස්. ප්‍රනාන්දු,එම්.එස්. ප්‍රනාන්දු,Key,"ගෝල්ඩන් පොප්, ඉල්ලීම",එඩ්ගා පෙරේරා,බෝල බෝල මැටි එක එක ගේනව ගුවන් යානයක් වාගේ පියඹා උළුවස්සේ පොඩි ගෙයක් හදනවා// කා කැන්දන් එන්නද කුඹලෝ කා කැන්දන් එන්නද කුඹලෝ කොයිබට යනවද කොහෙන් ගෙනෙනවද නිවස තනන්නට මැටි අනලා පස්සෙන් එන්නද දුවගෙන එන්නද ඔබගේ තොරතුරු ගැන සොයලා ගං ඉවුරෙන්ද ගෙනෙන්නේ කවුරුද උදව් කරන්නේ// කාමර කීයද ගබඩා කීයද සැලසුම හැදුවෙත් නුඹම තමයි නෑදෑයන් හට එන්න කියනවද නැකතක් බැලුවද සිරිත එයයි පෙම්බර සුවඳ හමන්නේ සංගීතයකි ඇසෙන්නේ//,බෝල බෝල මැටි,1662,bola bola mati
194,එම්.එස්. ප්‍රනාන්දු,එම්.එස්. ප්‍රනාන්දු,Key,ගෝල්ඩන් පොප්,එම්.එස්. ප්‍රනාන්දු,ගල්කිස්සෙ හෝටලෙ ළඟ ආතර් අයියා හෝටලෙ ළඟ// සර් හයිරිං කාර් අයි නෝ ඕල් ද බාර් ඕල් සිලෝන් ටුවර් ගොයින් අයි ගිව් මයි කාර්// අයි නෝ කැන්ඩි රෝඩ් අයි නෝ සීගිරිය රෝඩ් අයි නෝ මඩකලපු රෝඩ් අයි නෝ ගල්ඕය බෝඩ් ටේක් යූ ටු ජෙම් මර්චන්ට් දැට් ඉස් කහවත්ත රෝඩ් ඇළහැර බකමූණේ මයි ෆ්‍රෙන්ඩ් මැණික් ලෝඩ් මයි ෆ්‍රෙන්ඩ් මැණික් ලෝඩ් අයි සෝයූ වයිල්ඩ් ඇලිෆන්ට් වී මස්ට් ගෝ යාල කැළේ අයි ගිව් යූ මිල්ක් ඇන්ඩ් හනි පාසිං මාතර නගරේ අයි ටෙල් යූ ගුඩු ස්ටෝරි අබවුට් පණාමුරේ යූ කැන් සී බ්ග් ටෙම්පල් ගොයින් ටු අනුරාධපුරේ ගොයින් ටු අනුරාධපුරේ යුවර් වයිෆ් මැඩම් මිසිස් කෝලින් ඇන්ඩ් කම්කො ප්ලීස් අයි ගිව් හර් කැවුම් කොකිස් ලන්ච් ටයිම් ෆුඩ් පොකිරිස් අයි නෝ බෙටර් ඉන්ග්ලිෂ් ලයික් ඊටින් ලුණු මිරිස් මයි ෆ්‍රෙන්ඩ් සිංගර් එම් එස් ඕල් සිලෝන් බයිල ටුවිස්ට් ඕල් සිලෝන් බයිල ටුවිස්ට්,ගල්කිස්සෙ හෝටලෙ,545,galkisse hotale
195,එම්.එස්. ප්‍රනාන්දු,එම්.එස්. ප්‍රනාන්දු,Key,ගෝල්ඩන් පොප්,එම්.එස්. ප්‍රනාන්දු,ලස්සන අඹ ගසක් සොයාලා ලස්සන කූඩුවක් සදාලා ලස්සන කිරිල්ලී මෙ මාගේ ආවේ එක්ක යන්න මං // සදාපු කූඩුව මං මුලදි කැඩී බිඳී සිඳී ගියා ඒ හින්ද තව එකක් සදාලා ආවේ එක්ක යන්න මං ඒ වාගේ සැඩසුළං ඇවිල්ලා යයිද මේ කූඩුවත් කැඩීලා ඔබ මාගේ ළඟ ඉන්නවානම් සෝකෙත් සැපක් සේ දැනෙයි රසබර පල වැල නෙලාලා කූඩුව වෙතට ගෙන ඇවිල්ලා ඔයාගෙ ළඟ ඉඳන් කවන්නම් ලස්සන කිරිල්ලී මෙ මාගේ උදෑසනෙන් මම පිබිදීලා පෙම්බර ගීතයක් ගයාලා ඔයාගෙ සිත තුටින් තබන්නම් ලස්සන කිරිල්ලී මෙ මාගේ,ලස්සන අඹ ගසක්,954,lassana amba gasak
196,එම්.එස්. ප්‍රනාන්දු,එම්.එස්. ප්‍රනාන්දු,Key,ගෝල්ඩන් පොප්,එම්.එස්. ප්‍රනාන්දු,ලස්සන රෝස මලක් මට ලස්සන නෑ ලස්සන සමනලය මට ලස්සන නෑ ලස්සන කිසිම දෙයක් මට ලස්සන නෑ ලස්සන නෑ ලස්සන නෑ ආදරවන්තියේ ඔබ... වාගේ නෑ// නිල්මිණි තිබේ මිණිපුරේ මුතු තිබේ හරි අගේ රන් වලින් දැං වැල් සදා නැතේ මට අගේ නැත පිනවන්න මගේ හිත ඇතේ ප්රියා ආදරී ඇතේ මාව සනසන්න පිනවන්න මිණිමුතු රන්වලින් බෑ ඇලේ දොලේ ගංගාවේ දිය ඇල්ලේ මගේ හිත නෑ නැතේ මට අගේ නැත පිනවන්න මගේ හිත ඇතේ ප්රියා ආදරී ඇතේ කෝකිලයගෙ සුමිහිරි ගීතය මිහිරිවේ සුන්දරයි දෙසවන් පිනා නැතේ මට අගේ නැත පිනවන්න මගේ හිත ඇතේ ප්රියා ආදරී ඇතේ ඈගෙ සුදු මුහුන දුක් වීල ඇඩුවාට කැතවෙන්නෙ නෑ මම ඔබෙ ඔබ මගෙ මගෙ හිත වෙන්වෙන්නෙ නෑ නැතේ මට අගේ නැත පිනවන්න මගේ හිත ඇතේ ප්රියා ආදරී ඇතේ,ලස්සන රෝස මලක්,1317,lassana rosa malak
197,එම්.එස්. ප්‍රනාන්දු,එම්.එස්. ප්‍රනාන්දු,Key,ගෝල්ඩන් පොප්,එම්.එස්. ප්‍රනාන්දු,මම එන්නෙ ඩුබායි රටේ ඉඳල සල්ලි හොඳට හම්බකරල හම්බකරපු සල්ලි මා ළඟයි හරි ලස්සන පොඩි ගෙයක් හදල ටීවී රේඩියෝ දාල හම්බකරපු සල්ලි මා ළඟයි මගෙ අතේ මිටේ සතේ නැතිව ඉල්ලගන්න කෙනෙක් නැතිව හිතේ අමාරුවෙන් හිටියෙ මං මම එන්නෙ ඩුබායි රටේ ඉඳල සල්ලි හොඳට හම්බකරල හම්බකරපු සල්ලි මා ළඟයි එරන්දතී මට කැමැත්ත දුන්නැහැ අම්ම තාත්තල මූණ බැලුවෙ නැහැ // දැන්නං බලනව දුක සැප අහනව මොකක්ද වෙනසක් සිදුවෙල තිබෙනව එන්නෙ ඩුබායි රටේ ඉඳල මම එනතුරු සිව් වසරක් හිටියලු මට ජය ලැබෙන්න ආසිරි පැතුවලු // පොහොසත් වෙනකොට යහපත් වෙන්නලු අහක බැලුවෙ ඇයි හිත රිදෙනවාලු එන්නෙ ඩුබායි රටේ ඉඳල සල්ලි හොඳට හම්බකරල හම්බකරපු සල්ලි මා ළඟයි මංගල යෝජනා දවසට දෙක තුන නැන්දල මාමල ආවද කොපමණ // ආඩම්බරකම් කුමකට පෙන්වන එහෙනම් මගෙ හිත එරන්දතී ගැන එන්නෙ ඩුබායි රටේ ඉඳල,මම එන්නෙ ඩුබායි රටේ,1030,mama enne dubai
198,එම්.එස්. ප්‍රනාන්දු,එම්.එස්. ප්‍රනාන්දු,Key,"පැරණි පොප්ස්, ඉල්ලීම",ආර්.ඒ.චන්ද්‍රසේන,අවුදුරු පණස් තුනයි වයස බැලු බැල්මට කියන්න බෑ තාමත් කොල්ල වගේ ඉන්නේ හැට පැන්නත් නැකි වෙන්නෙ නෑ සුළු දෙයක්නෙ තවම ඔහෙල මේක දන්නෙ නෑ නාකි නොවී ඉන්න රහස හංග ගන්නෙ නෑ// කියල දෙන්න තෑගි බෝග ඕන වෙන්නෙ නෑ ලේසි පහසු දෙයක් නොවේ හිතුවොත් බැරි නෑ පුහු මැනෙන් ඉදිමුන සිත පිරිසිදු වෙන්නෑ අමනාපෙන් වෙන්වූ විට සිතට සතුට නෑ // සිතේ සතුට නැතිදා සැනසීම සිතට නෑ සිත පිරිසිදු අය කවදත් නාකි වෙන්නෙ නෑ,අවුදුරු පණස් තුනයි,3195,awurudu panas thunai
199,එම්.එස්. ප්‍රනාන්දු,එම්.එස්. ප්‍රනාන්දු,Key,"ගෝල්ඩන් පොප්, ඉල්ලීම",එඩ්ගා පෙරේරා,බෝල බෝල මැටි එක එක ගේනව ගුවන් යානයක් වාගේ පියඹා උළුවස්සේ පොඩි ගෙයක් හදනවා// කා කැන්දන් එන්නද කුඹලෝ කා කැන්දන් එන්නද කුඹලෝ කොයිබට යනවද කොහෙන් ගෙනෙනවද නිවස තනන්නට මැටි අනලා පස්සෙන් එන්නද දුවගෙන එන්නද ඔබගේ තොරතුරු ගැන සොයලා ගං ඉවුරෙන්ද ගෙනෙන්නේ කවුරුද උදව් කරන්නේ// කාමර කීයද ගබඩා කීයද සැලසුම හැදුවෙත් නුඹම තමයි නෑදෑයන් හට එන්න කියනවද නැකතක් බැලුවද සිරිත එයයි පෙම්බර සුවඳ හමන්නේ සංගීතයකි ඇසෙන්නේ//,බෝල බෝල මැටි,1662,bola bola mati
200,එම්.එස්. ප්‍රනාන්දු,එම්.එස්. ප්‍රනාන්දු,Key,ගෝල්ඩන් පොප්,එම්.එස්. ප්‍රනාන්දු,ගල්කිස්සෙ හෝටලෙ ළඟ ආතර් අයියා හෝටලෙ ළඟ// සර් හයිරිං කාර් අයි නෝ ඕල් ද බාර් ඕල් සිලෝන් ටුවර් ගොයින් අයි ගිව් මයි කාර්// අයි නෝ කැන්ඩි රෝඩ් අයි නෝ සීගිරිය රෝඩ් අයි නෝ මඩකලපු රෝඩ් අයි නෝ ගල්ඕය බෝඩ් ටේක් යූ ටු ජෙම් මර්චන්ට් දැට් ඉස් කහවත්ත රෝඩ් ඇළහැර බකමූණේ මයි ෆ්‍රෙන්ඩ් මැණික් ලෝඩ් මයි ෆ්‍රෙන්ඩ් මැණික් ලෝඩ් අයි සෝයූ වයිල්ඩ් ඇලිෆන්ට් වී මස්ට් ගෝ යාල කැළේ අයි ගිව් යූ මිල්ක් ඇන්ඩ් හනි පාසිං මාතර නගරේ අයි ටෙල් යූ ගුඩු ස්ටෝරි අබවුට් පණාමුරේ යූ කැන් සී බ්ග් ටෙම්පල් ගොයින් ටු අනුරාධපුරේ ගොයින් ටු අනුරාධපුරේ යුවර් වයිෆ් මැඩම් මිසිස් කෝලින් ඇන්ඩ් කම්කො ප්ලීස් අයි ගිව් හර් කැවුම් කොකිස් ලන්ච් ටයිම් ෆුඩ් පොකිරිස් අයි නෝ බෙටර් ඉන්ග්ලිෂ් ලයික් ඊටින් ලුණු මිරිස් මයි ෆ්‍රෙන්ඩ් සිංගර් එම් එස් ඕල් සිලෝන් බයිල ටුවිස්ට් ඕල් සිලෝන් බයිල ටුවිස්ට්,ගල්කිස්සෙ හෝටලෙ,545,galkisse hotale
201,එම්.එස්. ප්‍රනාන්දු,එම්.එස්. ප්‍රනාන්දු,Key,ගෝල්ඩන් පොප්,එම්.එස්. ප්‍රනාන්දු,ලස්සන අඹ ගසක් සොයාලා ලස්සන කූඩුවක් සදාලා ලස්සන කිරිල්ලී මෙ මාගේ ආවේ එක්ක යන්න මං // සදාපු කූඩුව මං මුලදි කැඩී බිඳී සිඳී ගියා ඒ හින්ද තව එකක් සදාලා ආවේ එක්ක යන්න මං ඒ වාගේ සැඩසුළං ඇවිල්ලා යයිද මේ කූඩුවත් කැඩීලා ඔබ මාගේ ළඟ ඉන්නවානම් සෝකෙත් සැපක් සේ දැනෙයි රසබර පල වැල නෙලාලා කූඩුව වෙතට ගෙන ඇවිල්ලා ඔයාගෙ ළඟ ඉඳන් කවන්නම් ලස්සන කිරිල්ලී මෙ මාගේ උදෑසනෙන් මම පිබිදීලා පෙම්බර ගීතයක් ගයාලා ඔයාගෙ සිත තුටින් තබන්නම් ලස්සන කිරිල්ලී මෙ මාගේ,ලස්සන අඹ ගසක්,954,lassana amba gasak
202,එම්.එස්. ප්‍රනාන්දු,එම්.එස්. ප්‍රනාන්දු,Key,ගෝල්ඩන් පොප්,එම්.එස්. ප්‍රනාන්දු,ලස්සන රෝස මලක් මට ලස්සන නෑ ලස්සන සමනලය මට ලස්සන නෑ ලස්සන කිසිම දෙයක් මට ලස්සන නෑ ලස්සන නෑ ලස්සන නෑ ආදරවන්තියේ ඔබ... වාගේ නෑ// නිල්මිණි තිබේ මිණිපුරේ මුතු තිබේ හරි අගේ රන් වලින් දැං වැල් සදා නැතේ මට අගේ නැත පිනවන්න මගේ හිත ඇතේ ප්රියා ආදරී ඇතේ මාව සනසන්න පිනවන්න මිණිමුතු රන්වලින් බෑ ඇලේ දොලේ ගංගාවේ දිය ඇල්ලේ මගේ හිත නෑ නැතේ මට අගේ නැත පිනවන්න මගේ හිත ඇතේ ප්රියා ආදරී ඇතේ කෝකිලයගෙ සුමිහිරි ගීතය මිහිරිවේ සුන්දරයි දෙසවන් පිනා නැතේ මට අගේ නැත පිනවන්න මගේ හිත ඇතේ ප්රියා ආදරී ඇතේ ඈගෙ සුදු මුහුන දුක් වීල ඇඩුවාට කැතවෙන්නෙ නෑ මම ඔබෙ ඔබ මගෙ මගෙ හිත වෙන්වෙන්නෙ නෑ නැතේ මට අගේ නැත පිනවන්න මගේ හිත ඇතේ ප්රියා ආදරී ඇතේ,ලස්සන රෝස මලක්,1317,lassana rosa malak
203,එම්.එස්. ප්‍රනාන්දු,එම්.එස්. ප්‍රනාන්දු,Key,ගෝල්ඩන් පොප්,එම්.එස්. ප්‍රනාන්දු,මම එන්නෙ ඩුබායි රටේ ඉඳල සල්ලි හොඳට හම්බකරල හම්බකරපු සල්ලි මා ළඟයි හරි ලස්සන පොඩි ගෙයක් හදල ටීවී රේඩියෝ දාල හම්බකරපු සල්ලි මා ළඟයි මගෙ අතේ මිටේ සතේ නැතිව ඉල්ලගන්න කෙනෙක් නැතිව හිතේ අමාරුවෙන් හිටියෙ මං මම එන්නෙ ඩුබායි රටේ ඉඳල සල්ලි හොඳට හම්බකරල හම්බකරපු සල්ලි මා ළඟයි එරන්දතී මට කැමැත්ත දුන්නැහැ අම්ම තාත්තල මූණ බැලුවෙ නැහැ // දැන්නං බලනව දුක සැප අහනව මොකක්ද වෙනසක් සිදුවෙල තිබෙනව එන්නෙ ඩුබායි රටේ ඉඳල මම එනතුරු සිව් වසරක් හිටියලු මට ජය ලැබෙන්න ආසිරි පැතුවලු // පොහොසත් වෙනකොට යහපත් වෙන්නලු අහක බැලුවෙ ඇයි හිත රිදෙනවාලු එන්නෙ ඩුබායි රටේ ඉඳල සල්ලි හොඳට හම්බකරල හම්බකරපු සල්ලි මා ළඟයි මංගල යෝජනා දවසට දෙක තුන නැන්දල මාමල ආවද කොපමණ // ආඩම්බරකම් කුමකට පෙන්වන එහෙනම් මගෙ හිත එරන්දතී ගැන එන්නෙ ඩුබායි රටේ ඉඳල,මම එන්නෙ ඩුබායි රටේ,1030,mama enne dubai
204,එම්.එස්. ප්‍රනාන්දු,එම්.එස්. ප්‍රනාන්දු,Key,චිත්‍රපට ගීත,පී.එල්.ඒ.,මැණිකෙ මම ආයෙ ගෙදර එනවා මට හරි කේන්ති යනවා// කොච්චර ආදරෙ කෙරුවත් මා ගැන අවිස්වාස වෙනවා ඉවසල ඉවසල අන්තිමේදි මට හරි කේනති යනවා ගහන්න බනින්න හිතට දුකයි මම ගෙදරින් පිටවෙනවා මින් පසු එන්නැහැ කියල ගියත් මම ආයෙ ගෙදර එනවා වීලා බෙහොම දුක් වීලා ඈ අඬාවි ගියොතින් දමාලා හැමදාමත් මෙහෙම සිතාලා කොහොම ඉන්නද මම ඉවසාලා මම යනවා යන්ඩ ඈ දාලා මගෙ ඉවසුම මට නැතිවීලා ඈ ඇවිදින් මාව සොයාලා එක්කං යයි අඬා වැලපීලා රෝස මලක් වගේ ඇගෙ මූනේ පින්බර පෙනුමයි මට ඕනේ තව ලස්සන මල් හමුවන්නේ රෝස මලයි මගේ හිත ගන්නේ වෙන මලක් සොයා මම යන්නෑ මේ මල වෙන කාටත්දෙන්නෑ විපතක් කිසි දවසක වෙන්නෑ මගෙ ආදරෙ ඈ අඳුනන් නෑ,මැණිකෙ මම ආයෙ,1207,manike mama aye
205,එම්.එස්. ප්‍රනාන්දු,එම්.එස්. ප්‍රනාන්දු,Key,ගෝල්ඩන් පොප්,එම්.එස්. ප්‍රනාන්දු,ඔබ දකින දකින දිනක මහද පොකුණු තලාවේ කිරි පැහැති සුසුදු සුමුදු සිනිදු කුමුදු හිනාවේ // කුමුදු හිනාවේ මේ පොකුණු තලාවේ පොකුණු තලාවේ කුමුදු හිනාවේ මල් දහසක සුවඳින් සුවඳ වෙලා කුංකුම පිණි දිය ගා නළලෙ උලා රන්වන් කැළුම් නංවලා මල් දහසක සුවඳින් සුවඳ වෙලා කුංකුම පිණි දිය ගා නළලෙ උලා බඳ වටලා සළු පටලා සළු පටලා බඳ වටලා පෙති ගෝමර ඉසිලා ළය තුරුලේ සඳ බැබලේ රැඳිලා වත මඩලේ නිල් තරු දෑසෙ හැංගිලා පෙති ගෝමර ඉසිලා ළය තුරුලේ සඳ බැබලේ රැඳිලා වත මඩලේ ඔබ නැති දා ලොව නැත මා//,ඔබ දකින දකින,1048,oba dakina dakina
206,එම්.එස්. ප්‍රනාන්දු,එම්.එස්. ප්‍රනාන්දු,Key,"පැරණි පොප්ස්, ඉල්ලීම",ආර්.ඒ.චන්ද්‍රසේන,සැවැන්දරා සුගන්ධයෙන් හිමාලයේ සිසිල් සුවේ මගේ හිතයි ගතයි වෙළා සිනා සඳෙන් කැලුම් පෙරා// ඔබයි බලන්නේ ඔබයි බලන්නේ// රන් වන් කින්කිනි නාද නගන්නී සන්සුන් තාලෙට පාද තබන්නී // නිල් වන් දෑසින් සීන මවන්නී ඉරෙන් උපන් හඳෙන් උපන් මලෙන් උපන් විලෙන් උපන් ඔබයි බලන්නේ ඔබයි බලන්නේ චන්දන කල්කෙන් තිලක තියාලා රන් කුමු යුග්මය ලමැද දරාලා // සල් සල් සල් මල් සේ ම සැදීලා එහේ ඉඳන් මෙහේ ඉඳන් දුරින් ඉඳන් ළඟින් ඉඳන් ඔබයි බලන්නේ ඔබයි බලන්නේ,සැවැන්දරා සුගන්ධයෙන්,2811,sawandara sugandhayen
207,ක්ලැරන්ස් විජේවර්ධන,කුලරත්න ආරියවන්සන්,Key,පැරණි පොප්ස්,ක්ලැරන්ස් විජේවර්ධන,අඳුර ඉරා සඳ නිදි මේලාවේ පබලු වළා විහිරුනු වේලාවේ අඳුර පුරා අමරස වෑහීලා බිඳුනු සෙනේ කඳුලැලි පාවීලා කටුක ලොවේ ඝනදුරු සීමාවේ සතුට රැඳේ මතු මත් මායාවේ මනස නිවේ සැනසෙන හෝරාවේ දසත නැගී හසරැල් ගී රාවේ සොඳුරු රැයේ බොඳවුනු චායාවේ එලිය නිවී ඇගෙ රූ සේයාවේ දැහැල බැඳී සිතුවිලි මායාවේ කැකුලු පිපී මදහස රේඛාවේ,අඳුර ඉරා,924,andura ira
