,Artist,Lyrics,Key,Genre,Music,Song,Title,Visits,title-en
392,ඉන්ද්‍රානි පෙරේරා,ක්ලැරන්ස් විජේවර්ධන,Key,"කැලිප්සෝ, ගෝල්ඩන් පොප්",ක්ලැරන්ස් විජේවර්ධන,දිල්හානී දුවනී නාඬා නිදියන්නේ නිවසට සුරතල් ආලෝකය දී නාඬා නිදියන්නේ දෑත දෙපා සලමින් ඇය කරනා සුරතල් දැකගන්න වාසනාව මට ගෙනදුන් දියණී සුරතල් දිල්හානී රන් ඔන්චිල්ලේ ඇයව හොවාලා පදවන්නට සිතුනා රන් තැටියේ කිරි පැණි පුරවාලා ගෙන එන්නට සිතුනා රන්වන් තටු ඇති සමනළයින් දැක ඇයගෙ දෙතොල් පිපුණා රන්වන් මුහුණේ ලස්සන දැකලා සිපගන්නට සිතුනා,දිල්හානී දුවනී,2905,dilhani duwani
393,ඉන්ද්‍රානි පෙරේරා,ක්ලැරන්ස් විජේවර්ධන,Key,ගෝල්ඩන් පොප්,ක්ලැරන්ස් විජේවර්ධන,එදා තරම් මගේ සිතේ රැඳුණේ නැහැ තව දවසක් දුටුවා ඔබ මැද සිටියා විදුලි බුබුළු දස දහසක් සැණකෙළියේ කිසිම දෙයක දැණුනේ නැහැ මට වෙනසක් පෙණුනේ මට ඔබේ දෙනෙත්වල ලියවුණු පොඩි රහසක් සැණකෙළියේ විසිතුරු මට මොහොතින් අමතක වුණාද ඔබ මා ළඟ සිටගත්තේ කොයි පැත්තෙන් පාවුණාද අක්ක අයිය නංගි මල්ලි මැද මගෙ සිත ගොළු වුණාද දෙනෙත්වලින් මා පැවසූ රහස ඔබට වැටහුණාද මුව කමලේ විසිතුරු දැක ඔබ මා හට හිනැහුණාද මගෙ දෙනෙතේ දැකුම් බලා සැනසුම් සුසුමක් ගියාද හෙට හවසත් මා එන තුරු මග බලමින් ඉන්නවාද සැණකෙළියේ අපේ පැතුම් විසිරී පැතිරී ගියාද,එදා තරම්,448,eda tharam
394,ක්ලැරන්ස් විජේවර්ධන,ක්ලැරන්ස් විජේවර්ධන,Key,පැරණි පොප්ස්,ක්ලැරන්ස් විජේවර්ධන,ආදරේට කියන කතා බොලඳ වුනාට.. සාගරේක ගැඹුර දැනෙයි නොවෙද ඔයාට... // තටු සිඳිලා වැලපෙනවා සිත බැඳිලා හිනැහෙනවා මල් ඇතුරූ සුව යහනේ මල් අතුරා පවන් සැලු ආදරවන්තයින් පෙලූ.. බොලඳ කතා මල් ගොමුවේ.. තුරු සෙවනේ.. හමුවෙනවා.. වෙන්වෙනවා.. උයන් කොනේ.. අවන් හලේ.. උයන් කොනේ හමුවෙනවා.. අවන්හලේ වෙන්වෙනවා.. බොලඳ කතා..,ආදරේට කියන කතා,2254,adareta kiyana katha
395,"ක්ලැරන්ස් විජේවර්ධන, ජැක්සන් ඇන්තනි",ක්ලැරන්ස් විජේවර්ධන,D major | Beat,"කණ්ඩායම් ගීත, පැරණි පොප්ස්",ක්ලැරන්ස් විජේවර්ධන,දෑස පියා ගත් කල මට මැවෙන්නෙ ඔබෙ රුව ඈත කඳුකරින් එන නල ගෙනෙන්නෙ ඔබෙ හඬ කුමාරියේ… අමතක නොවේ ලස්සන රුවේ...සිත සැනසුවේ අතින් අත වෙලී වෙරළේ තනි වූ මොහොතේ ඈත නිම් වළල්ලේ නෙත රැඳවුණු මොහොතේ සිත කැළඹුණේ ඇයි නොම දැනේ කී දෙයක් ද අරුමයක්ද මට සිතා ගන්න නොහේ රළින් රළ හැපී පෙණ කැටි විසිරෙනු දැකලා නිම් නොවූ සිතේ සතුටින් හසරැල් පිපිලා මතකය මගේ - අවදී වුණේ ඒ එදා ය - මේ මෙදා ය මට සිතාගන්න නොහේ,දෑස පියා ගත් කල,3168,desa piya gath kala
396,ක්ලැරන්ස් විජේවර්ධන,ක්ලැරන්ස් විජේවර්ධන,F major | Beat,පැරණි පොප්ස්,ක්ලැරන්ස් විජේවර්ධන,දේවතාවන් සිතන දේවල් දිව්‍ය ලෝකෙන් මෙපිට එන්නෑ හිරු රැසින් හැම පිණිබිඳක් වත් දිලිසි දිලිසි අවදි වෙන්නෑ දෛවයයි ඉරණමයි ජිවිතය සමගින්// රඟන රැඟුමක් දෝ දඟකාර සමනල් අවදියේ අපි ඉගිලුනේ අපේක්ෂාවන් කරා පිණි සුළගේ දැවටෙමින් කාන්සියට ගී ගැයුවා අපේ ගී ඇසුනේ අපට පමණයි,දේවතාවන්,699,dewathawan
397,ඉන්ද්‍රානි පෙරේරා,ක්ලැරන්ස් විජේවර්ධන,Key,"කැලිප්සෝ, ගෝල්ඩන් පොප්",ක්ලැරන්ස් විජේවර්ධන,දිල්හානී දුවනී නාඬා නිදියන්නේ නිවසට සුරතල් ආලෝකය දී නාඬා නිදියන්නේ දෑත දෙපා සලමින් ඇය කරනා සුරතල් දැකගන්න වාසනාව මට ගෙනදුන් දියණී සුරතල් දිල්හානී රන් ඔන්චිල්ලේ ඇයව හොවාලා පදවන්නට සිතුනා රන් තැටියේ කිරි පැණි පුරවාලා ගෙන එන්නට සිතුනා රන්වන් තටු ඇති සමනළයින් දැක ඇයගෙ දෙතොල් පිපුණා රන්වන් මුහුණේ ලස්සන දැකලා සිපගන්නට සිතුනා,දිල්හානී දුවනී,2905,dilhani duwani
398,ඉන්ද්‍රානි පෙරේරා,ක්ලැරන්ස් විජේවර්ධන,Key,ගෝල්ඩන් පොප්,ක්ලැරන්ස් විජේවර්ධන,එදා තරම් මගේ සිතේ රැඳුණේ නැහැ තව දවසක් දුටුවා ඔබ මැද සිටියා විදුලි බුබුළු දස දහසක් සැණකෙළියේ කිසිම දෙයක දැණුනේ නැහැ මට වෙනසක් පෙණුනේ මට ඔබේ දෙනෙත්වල ලියවුණු පොඩි රහසක් සැණකෙළියේ විසිතුරු මට මොහොතින් අමතක වුණාද ඔබ මා ළඟ සිටගත්තේ කොයි පැත්තෙන් පාවුණාද අක්ක අයිය නංගි මල්ලි මැද මගෙ සිත ගොළු වුණාද දෙනෙත්වලින් මා පැවසූ රහස ඔබට වැටහුණාද මුව කමලේ විසිතුරු දැක ඔබ මා හට හිනැහුණාද මගෙ දෙනෙතේ දැකුම් බලා සැනසුම් සුසුමක් ගියාද හෙට හවසත් මා එන තුරු මග බලමින් ඉන්නවාද සැණකෙළියේ අපේ පැතුම් විසිරී පැතිරී ගියාද,එදා තරම්,448,eda tharam
399,ඉන්ද්‍රානි පෙරේරා,ක්ලැරන්ස් විජේවර්ධන,Key,ගෝල්ඩන් පොප්,ක්ලැරන්ස් විජේවර්ධන,එක දවසක් මම දුටුවා තව දවසක් මුණ ගැසුණා දෙතොල සැළී බිඳුණු හඬින් ඔබ කී දේ මට සිහි නෑ...// සඳළු තලේ සිටියා බලා ඔබ එනවා මග බලලා දුරකථනේ මට පිහිට වුණේ මී බිඳු මාගේ සවන පිරේ කවදා කෙසේ හමුවේවිදෝ සිහින ලොවේ ළං වෙමුදෝ රහසේ බැඳී ඒ අප ආදරේ මහදේ තියේවී නැතිවී නොයේ,එක දවසක්,1381,eka dawasak
400,ක්ලැරන්ස් විජේවර්ධන,ක්ලැරන්ස් විජේවර්ධන,C major | Beat,පැරණි පොප්ස්,ක්ලැරන්ස් විජේවර්ධන,ගමෙන් ලියුමක් ඇවිල්ලා අක්කගෙන් වාගේ මොකක් කියලාද දන්නෑ එහෙ ගියෙත් නෑනේ// පහළ කුඹුරේ නිල් ගොයම් දැන් හරිම සරුසාරයි වැසි වැටී වැව් ළිං පිරිලා හරිම සිරියාවයි තවත් ආරංචි ගොඩයි….. ලියන්නට ලැජ්ජයි ගෙදර අය සතුටින් සිටින්නේ මල්ලි දැකගන්නයි කාලෙකින් මෙහෙ ආවෙ නෑනේ වැඩත් වැඩි වෙන්නයි ළඟදි එනවා නම් හොඳයි…… නිවාඩුව දැන් දැන් ළඟයි,ගමෙන් ලියුමක්,1378,gamen liyumak
401,ඉන්ද්‍රානි පෙරේරා,ක්ලැරන්ස් විජේවර්ධන,Key,"කණ්ඩායම් ගීත, ඉල්ලීම",ක්ලැරන්ස් විජේවර්ධන,හා හා හොරේ දැනුනා දැනුනා මට නාවේ මොකෝ කියලා මා හා සිතේ තරහක් තිබුනානමේ නොකීවේ මොකෝ සිතුනා// පහල ඇලේ දිය බුබුලේ අමුතු සීතලක් දැනුනා දෙවට දිගේ එන අතරේ ඔබ හමුවේයයි සිතුනා ලිහිණි ගිරාකැල වනමැද්දේ ගීහඬ මට ඇසුනා අවරගිරේ හිරු බැස යද්දී පාළුව මට දැනුනා,හා හා හොරේ,694,ha ha hore
402,ක්ලැරන්ස් විජේවර්ධන,ක්ලැරන්ස් විජේවර්ධන,A major | Beat,පැරණි පොප්ස්,ක්ලැරන්ස් විජේවර්ධන,හද විලේ ඔබ පිපුණා නිසසලේ පෙති සැළුණා දුනුකේ මල සේ යාවී.... හද විලේ ඔබ පිපුණා නිසසලේ පෙති සැළුණා ආශා දෑසින් බලා සිනාසී ඒ සිත මා සිත වෙලා ගනීවී දහසක් වනමල් පිපී සැලේවී ජීවන මංපෙත සරසාලා ආදර ගීතේ තනුව කියාදී ජීවන මීවිත සතුට සදාදී මෝහන ලාලිත බැළුම් හෙළාවී මා යන මාවත සරසාලා,හද විලේ,964,hada vile
403,ක්ලැරන්ස් විජේවර්ධන,"ක්ලැරන්ස් විජේවර්ධන, සුපර් ගෝල්ඩන් චයිම්ස්",Key,"කණ්ඩායම් ගීත, ඉල්ලීම","ක්ලැරන්ස් විජේවර්ධන, සුපර් ගෝල්ඩන් චයිම්ස්",හන්තානේ මන්ද මාරුතේ හැන්දෑවේ යන්තමින් ඇසේවි මා හා එදා ඔබ කී කතා සන්තාපේ සොතැවුල් එදා අපි දෙන්නා ආදරෙන් බෙදා සරසවියේ අපගේ ලෝකයේ ඇත ඒ අතීතේ හැන්දෑවේ සූළඟ හමනවා හන්තානේ තවම තියෙනවා මා තනිවෙලා ඔබ තනිවෙලා සිහිවෙවිදෝ නින්දේ ඔබ සිහිනයක් වෙලා කන්දේ අපි තැනක තනි වෙලා මගේ කුටියේ ඔබේ නම ලියා සිතුවමක් කලානේ හැන්දෑවේ සූළඟ හමනවා හන්තානේ තවම තියෙනවා මා තනිවෙලා ඔබ තනිවෙලා සිහිවෙවිදෝ,හන්තානේ මන්ද මාරුතේ,1242,hanthane manda maruthe
404,ඉන්ද්‍රානි පෙරේරා,ක්ලැරන්ස් විජේවර්ධන,Key,නොමැත,ක්ලැරන්ස් විජේවර්ධන,කල්පනී දුවනි සිත් සතන් පිරුණි හද රැඳුණු පැතුම් මගේ සිහින පැතුම් ආදර ලෝකෙට මා..කැඳවයි ලා සඳ පායන වේලාවේ ආදරයේ මුදු සේයාවේ මා අසලින් හිඳ පාන සිනා සම්පත සාමය සතුට ගෙනා සතුට ගෙනා මේ ලොව ඉමිහිරි ගී රාවේ ඔබ මා අමතන.. ඒ වාගේ ඔබ පමණි මට මේ ලෝකේ සම්පත සාමය……,,688,kalpani duwani 
405,ක්ලැරන්ස් විජේවර්ධන,ක්ලැරන්ස් විජේවර්ධන,D major | Beat,"දේවානුභාවයෙන්, පැරණි පොප්ස්",ක්ලැරන්ස් විජේවර්ධන,කඳ සුරිඳුනි ඔබේ ඔද තෙද දැක හද පිබිදුනු සිතැතිව පුද දෙමු බැතියෙන ඔබ යැදුමට ආවා අපිඔබ පිදුමට ආවා// සත්ගිරි වට කොට ඔබේ නිවහන ඇත සත්සිඳු පතලව ඔබේ කිතුගොස ඇත ඔබ යැදුමට ආවා අපිඔබ පිදුමට ආවා මයුරාසන මත වැජඹෙන තෙදැතිව උතුරන හදකින් පුදදෙමු බැතියෙන ඔබ යැදුමට ආවා අපිඔබ පිදුමට ආවා කඳ සුරිඳුනි ඔබේ පිහිට ලැබේවා මගෙ රට සවුසිරියෙන් සපිරේවා ඔබ යැදුමට ආවා අපිඔබ පිදුමට ආවා,කඳ සුරිඳුනි,827,kanda suriduni
406,"ක්ලැරන්ස් විජේවර්ධන, ඉන්ද්‍රානි පෙරේරා",ක්ලැරන්ස් විජේවර්ධන,A major | Beat,"ඩුවට්ස්, ඕල්ඩ් පොප්ස්",ක්ලැරන්ස් විජේවර්ධන,කඳුකරයේ සීතලේ මීදුම් තිර යා කෙරේ හඳුනා හද ආදරේ ගෙවමු අපි ජීවිතේ // සවන් පුරා එන ඔබේ ගී නදින් හදක් පිරී යනවා නුවන් පිරී ගිය කඳුලැලි අතරින් සිනා ගලා එනවා අපේ වෙනස්කම් මකා දමා සිතුම් පැතුම් නොමැකෙතියි අමා මුවේ සිනා දුක මකා දමා පිබිදේ,කඳුකරයේ සීතලේ,2988,kandukaraye seethale
407,ක්ලැරන්ස් විජේවර්ධන,ක්ලැරන්ස් විජේවර්ධන,Key,"ක්ලැසික්, කණ්ඩායම් ගීත",ක්ලැරන්ස් විජේවර්ධන,කිමද නාවේ ඇයි නාවෙ තරහ වී කවුද කීවේ බොරු කීවේ මගෙ දයා පෙර නූයේ ඇයි වුයෙ අද වාගේ කිමද නාවෙ ඇයි නාවෙ අද ඔයා සැමදාම බලා සිටියා මගෙ කව්ලුව ලගට වෙලා // කවදාවත් නැ වුයේ මෙ වාගෙ මගෙ පැල්පත අද පාලුයි නිහඩයි අදුරයි ඇත්තේ // කවදාවත් නැ වුයේ මෙ වාගෙ,කිමද නාවේ,885,kimada nawe
408,ක්ලැරන්ස් විජේවර්ධන,ක්ලැරන්ස් විජේවර්ධන,Key,"ක්ලැසික්, කණ්ඩායම් ගීත",ක්ලැරන්ස් විජේවර්ධන,කිමද නාවේ ඇයි නාවෙ තරහ වී කවුද කීවේ බොරු කීවේ මගෙ දයා පෙර නූයේ ඇයි වුයෙ අද වාගේ කිමද නාවෙ ඇයි නාවෙ අද ඔයා සැමදාම බලා සිටියා මගෙ කව්ලුව ලගට වෙලා // කවදාවත් නැ වුයේ මෙ වාගෙ මගෙ පැල්පත අද පාලුයි නිහඩයි අදුරයි ඇත්තේ // කවදාවත් නැ වුයේ මෙ වාගෙ,කිමද නාවේ,885,kimada nawe
409,ක්ලැරන්ස් විජේවර්ධන,ක්ලැරන්ස් විජේවර්ධන,A major | Beat,පැරණි පොප්ස්,ක්ලැරන්ස් විජේවර්ධන,කිරි මුහුද කළඹාලා ගෙනා මගේ කුඩා පුතුටයි මුතු මාලිගාවෙන් මා ගෙනා පැතුම් මගේ පුතුටයි ගීතයයි මලයි සිහින ලෝකයයි රන්තරුයි සඳයි පුතේ නුඹේ තමයි හීනෙකින් නුඹේ දෙතොල් සැලෙයි ඉබේ තරු මෙන් ගුවන් ගැබේ දිලෙයි දෙනෙත් ඔබේ තාත්තගේ සිතේ පැතුම් පිරී ඇතේ අම්මගේ සිතේ සෙනේ පිරී ඇතේ ඔබේ කුඩා නෙතේ ඇළුම් බැළුම් පුතේ සදා අපේ සිතේ රැඳී දිලෙයි පුතේ,කිරි මුහුද කළඹාලා,1125,kiri muhuda
410,"ඇනස්ලි මලවානා, ලිලන්ති කරුණානයක",ක්ලැරන්ස් විජේවර්ධන,F major | Beat,"ඩුවට්ස්, ගෝල්ඩන් පොප්, කණ්ඩායම් ගීත",ක්ලැරන්ස් විජේවර්ධන,කියන්න සුළගේ ඔබ කොයි සිටදෝ එන්නේ සැරින් සැරේ හෙමින් ඇවිත් හයියෙන් යන්නේ // කොහෙන් කොහොම ආවත් මොකටද විමසන්නෙ වනන්තරේ ඔබ දැක නැති තැනකිනි එන්නේ හමන තාලයටද ගහේ අතු කොල නැටුවේ අතර මගදි ඔබ එනවිට මොනවද දුටුවේ ගොපලු පුතෙක් ගියා උදේ ගවරැළ දක්කා මට අත වන වන කුඹුරක් නැටු හැටි දැක්කා සමගි වෙල තැන තැන යනවාලු එක රැලේ කැලය මැදදි සත්තු දැක්කෙ නැද්ද මඳනලේ කුරුලු මවක් නැතිවුණ පොඩි පැටවෙකු සෙව්වා තුරුලු කරන් මුවදෙන පැටියට කිරි පෙව්වා,කියන්න සුළගේ,2525,kiyanna sulange
411,ටී.එම්.ජයරත්න,ක්ලැරන්ස් විජේවර්ධන,E major,පැරණි පොප්ස්,ක්ලැරන්ස් විජේවර්ධන,කුන්ද සමන් මල් මල් රැන්දු සිනාවා කන්ද උඩින් පෑයූ චන්ද්‍ර සිනාවා නෙල්ලි කැලේ හැංගී ඉන්න කුමාරී පින්න පිපුනු සීතේ එන්න සිනාසී රංචු බිඟුන් සේනා කැන්දු සිනාවා පුංචි සමන් මල් රොන් බිංදු සිනාවා පිපි මලසේ.හිමිදිරියේ.ඔසරි පොටේ සුදු නෙරියේ..හිත දැවටේ.සිලි සිලියේ මට නොදැනී.මට අමතා.පටු නළලේ කියඹු ලතා.මුදු මුදුසේ.සැලෙන ලතා,කුන්ද සමන්,722,kunda saman
412,"ක්ලැරන්ස් විජේවර්ධන, ඉන්ද්‍රානි පෙරේරා",ක්ලැරන්ස් විජේවර්ධන,Key,"යුගල, කණ්ඩායම් ගීත",ක්ලැරන්ස් විජේවර්ධන,ලපලු සෙවනේ ලැගුම් අරගෙන ඔබත් සමගින් තනිවෙලා සුරත සුරතේ තබා දිවුරෑ වදන් අද ඇත ගොළු වෙලා// ඟඟේ ඉවුරේ වැලි තලාවේ අපේ නම් ලියලා ඔබ එදා කී රස කතාවන් සිතේ ගොළු වීලා// මලක් මියයන අයුරු අපගේ සෙනෙහෙ දම් බිඳිලා එසේ පවසන වටදි මා හද බිඳී යයි තැවිලා,ලපලු සෙවනේ,388,lapalu sewane
413,මිල්ටන් මල්ලවරාච්චි,ක්ලැරන්ස් විජේවර්ධන,D major,නව පොප්,ක්ලැරන්ස් විජේවර්ධන,මා හා සෙනෙහස පාලා ඇය මා හා සිත බැඳුනා සැනසීමක් සිතට දැනීලා පිරුනා සේ මට දැනුනා ආවා සොයාලා ඔබේ ආදරේ නෑ මා තැවෙන්නේ සොයාලා සෙනේ සිහිනෙන් රැයේ දුටුවා ප්‍රියේ // දෙදෙනා බැඳී ආදරේ ඔබටයි කියාලා ගීයක් ලියා එය මා ගයන්නම් දිනයක් සොයා පැතුමන් සිතේ ඉතිරී යතේ // දෙදෙනා බැඳී ආදරේ,මා හා සෙනෙහස,1006,ma ha senehasa pala
