,Artist,Lyrics,Key,Genre,Music,Song,Title,Visits,title-en
593,සනත් නන්දසිරි,අජන්තා රණසිංහ,Key,පැරණි පොප්ස්,සනත් නන්දසිරි,ආදර සැමරුම් කැටිවූ නෙතු කඳුළින් මුතු පබළු නිමා කළෙමි සිහිවටනය යමුනා තීරේ..යමුනා තීරේ// එවන් නිමල මැදුර බලා වඩින්න දේවියේ මහද අඳුරු ලෙන අතහැර වඩින්න දේවියේ දහසක් මිණි මල් ලිය කම් පෙම පිදු වූ රන් කැටයම්// යමුනාවේ තරඟ මතින් මත පිළිබිඹු වේවා චමත් කාර අතීත සඳ යළිත් ජනිත වේවා අපගේ පෙම් පුරාවතින් දෙරණ හෙළු කඳුළු ගලා මැදුරත කිරිගරුඬ පවුරු පබා කැළුම් දේවා සනාතන වූ පෙම් සිතුවම් එහි සටහන් වේවා,ආදර සැමරුම්,2554,adara samarum
594,සෝමතිලක ජයමහා,අජන්තා රණසිංහ,Key,ක්ලැසික්,පරාජය කිරීමෙන් පසු,අපි ආයෙත් හමු නොවුණා නම් ඉස්සර දවසක මිය ගිය සෙනෙහස යළි ඉපදී මා හද හඬවන්නට අපි ආයෙත් හමු නොවුණා නම් ඔබ නාඳුනනා විරහ වේදනා පෙරදා වින්දේ මා පමණයි// හුඟ කලකින් හමුවී සෝ ළතැවුල් අදත් විඳින්නේ මා පමණයි සමුගන්නට නම් අහිමි ආදරෙන් ආයෙත් ඇයි අප හමුවන්නේ// ආදරයේ කඳුළින් මිය යන්නද ජීවිත ඉරණම විසඳෙන්නේ,අපි ආයෙත් හමු,1692,api ayeth hamu
595,වික්ටර් රත්නායක,අජන්තා රණසිංහ,Key,ගෝල්ඩන් ඕල්ඩීස්,වික්ටර් රත්නායක,ආශා නිරාශා මැවූ ඈ ස්වප්න මායාවකී ස්නේහේ ගඟුල් ප්‍රේමේ තැවුල් මැවූ ඉන්ද්‍රජාලේ ඇයයි // දවාලන්න පෙම්මාරුතේ ඇයයි ළංව ඉන්නේ සිතේ නිවාලන්න දුක් ජීවිතේ ඇයයි නිල්ල මල් මාවතේ දිවා රැයේ මා ළඟයි මගේ අරුම පෙම් අංගනා නෙතේ හැංගි හැංගී හිඳී සිතේ ස්වර්ණ යහනේ නිදී මුවේ මන්දහාසේ දිදී මගේ නින්ද ආයේ බිදී දිවා රැයේ මා ළඟයි මගේ අරුම පෙම් අංගනා,ආශා නිරාශා මැවූ,2800,asha nirasha mawu
596,නීලා වික්‍රමසිංහ,අජන්තා රණසිංහ,Key,චිත්‍රපට ගීත,සරත් දසනායක,බෝධියේ විහාරයේ පිදූ පියුම් වැනි වූ බාලිකා ලොව මැලවුන දා මුළු ලොවටම රෑ වෙනවා // මල් පොහොට්ටු මා හදේ සුරංගනා පොකුණේ මල් වරම් ලැබ පිපෙන තුරා ඔබ නටුවෙන් බිඳිනු එපා ජීවිතේ කියා හඬින් සිනා සිසී හිදිනා ඒ සිනා මා බොළඳ නෙතේ උණු කදුළක් කරනු එපා,බෝධියේ විහාරයේ,583,bodhiye viharaye
597,"අබේවර්ධන බාලසූරිය, සුජාතා අත්තනායක",අජන්තා රණසිංහ,G major,"යුගල, චිත්‍රපට ගීත, පැරණි පොප්ස්",සරත් දසනායක,බොඳ මීදුම් කඳුරැල්ලේ සුරංගනා රජ දහනේ ඔබේ සිනා කඳුළු බිඳක් හෙටත් වාසනා - හෙටත් වාසනාවන් සිහින නදී නළ රැල්ලේ පැතුම් රුවන් රන් ඔරුවේ ඔබේ නිමල නිද්‍රා ගී මටත් වාසනා - මටත් වාසනාවන් සිතක තැවුල් සංසිඳිලා මිටියාවත මල් ඉසිලා මල් වරුසා සුවඳ සමය මටත් වාසනා මටත් වාසනාවන් රෑ සියන්නෙ නොනිමි නාද සැවුල් කොවුල් විහඟ ගීත අපට ඇරැනු හුදකලාව මටත් වාසනා හෙටත් වාසනාවන් සිහින නදී නළ රැල්ලේ - පැතුම් රුවන් රන් ඔරුවේ ඔබේ නිමල නිද්‍රා ගී මටත් වාසනා - මටත් වාසනාවන් මාල හතක් පලඳන්නට හීන හතක් එළිවන්නට දොළොස් මහේ පහන් එළිය මටත් වාසනා හෙටත් වාසනාවන් අනාගතය කිරිළු දරා දෙපාමුලට වඩින තුරා ළවන් පොඟන මියුරැ තෙපුල් මටත් වාසනා හෙටත් වාසනාවන්////,බොඳ මීදුම්,1932,bonda meedum
598,"නෙළු අධිකාරී, රූකන්තා ගුණතිලක",අජන්තා රණසිංහ,Key,"වත්මන් ගීත, යුගල, ඉල්ලීම",රූකන්ත ගුණතිලක,දෑසම රිද්දන හසගන තාලෙට පාද නගාගෙන කවුද හැබෑටම මේ යන රන් ළන්ඳා කිව්වානාහන මේ මගෙ දෑසම ඇසිපිය නොහෙළනවා මේ හැටි ලස්සන රූ වරුනාවට ඉබේම නැවතුනු හිටි පාදෙම ඔය කී රූ වරුණා මා ගැන නම් මේ අහන්න ආසයි ආයෙම මයෙ වරුණා මල් පෙති වාගේ පාද රිදෙද්දෝ බොරළු ප‍යේ ඇනිලා මා‍ ගැන මන්දෝ මේ අනුකම්පා හිතට දුකක් දැනිලා ආලේ කුසුමෙන් මා හිත පිපිලා සුවඳ හදේ රැඳිලා පේරද නාරං බෝවිටියා දං අපට කඩා දෙයිදෝ බුරුතු පිටින් මේ වාරේ අවාරේ නෙලාන ඉන්නම් දෝ මේ ගුරු පා‍රේ මේ නෙතු ආයේ හෙටත් සිනා සෙයිදෝ,දෑසම රිද්දන,1397,dasama riddana
599,මිල්ටන් මල්ලවරාච්චි,අජන්තා රණසිංහ,D major,පැරණි පොප්ස්,ස්ටැන්ලි පියරිස්,දවසක් තියේවී වෙන් වුනු ඔබ මා නැවතත් මුණ ගැසෙනා කඳුලක් තියෙවී මා ලඟ එදිනේ ඔබේ නමින් ගලනා නටුවෙන් කඩලා මල විසිකල විලසේ වරදක් නැතත් මට ඔබ පිටු පෑ දවසේ වල්මත් වුනා මා අසරණ පෙම් පියසේ මට තාම නොදැනේ මොනව වුනා දෝ අප දෙදෙනාට ප්‍රියේ හිනැහෙනවා ඔබ මා හඬනා දවසේ නැලවෙනවා ඔබ ඔහු හා රස පහසේ ඔබටත් ලබාවී දවසක් මට වාගේ මට තාම නොදැනේ මොනව වුනා දෝ අප දෙදෙනාට ප්‍රියේ,දවසක් තියේවී,857,davasak thiyewee
600,ටී.එම්.ජයරත්න,අජන්තා රණසිංහ,F major,පැරණි පොප්ස්,ක්ලැරන්ස් විජේවර්ධන,දෙගොඩ තලා ගඟ ගලා මෙගොඩ ගොඩේ ඈ හිඳී තොටුපලේ ගං ඉවුරේ මා තනිවම මද අඳුරේ// මේ ගඟ ගලා ගියේ අපි පුංචි ළමුන් දවසේ ඇගෙ දෙපා පවා ආදරෙන් දොවා ආදර ඒ ගඟ නෑ අද නෑ මේ ඔරු කඳේ නැගී බොර පාට දියේ තනිවී මා මෙහා ඉමේ ඈ එහා ඉමේ බාධක මේ ගඟ තාම ගලයි,දෙගොඩ තලා,1227,degoda thala
601,දයරත්න රණතුංග,අජන්තා රණසිංහ,Key,ක්ලැසික්,දයරත්න රණතුංග,දුරස් වන්නට මේ ලෙසින් ඇයිද අප හමු වුණේ දුරස් වන්නට මේ ලෙසින් මොටද අප ඉපදුනේ අත් වැල් බැඳගෙන මංමාවත් දිග ඔහේ ඇවිද ගිය කාලය මතකද// පුංචි ළදැරියක් වගේ හුරතලෙන් ඔබ හිනැහුණු ඒ කාලය මතකද අනාගතය ගැන අහස් මාළිගා අප දෙදෙනා මැවු කාලය මතකද// ඔබේ පෙම්වතා ලෙසින් එදා මා ඔබේ ළඟින් උන් කාලය මතකද,දුරස් වන්නට,1546,duras wannata
602,ක්ලැරන්ස් විජේවර්ධන,අජන්තා රණසිංහ,A major | Beat,පැරණි පොප්ස්,ස්ටැන්ලි පියරිස්,දුව මා වගේ නේද නෑ අම්ම වාගේ දඟ කාර දූ කාගෙ දෝ දුව මා ගෙ දෝ අම්ම ගේ දූ නොවේදෝ කලුපාට දූ කාගෙ දෝ පාසැල් නොයන්නේ වස කම්මලී නේ කලුපාට දූ කාගෙ දෝ කලු නෑ සුදුයි නේ හරී ලස්සනයි නේ මගෙ පුංචි දෝනී මා වගේ සෙල්ලම් කරන්නයි තව සන්ඩු වෙන්නයි පොඩි මල්ලියෙක් ඔනලූ දූ මා වගේලූ මා දූ වගේලූ දෙන්නාට දෙන්නා යාලුවෝ,දුව මා වගේ,1447,duwa ma wage
603,සනත් නන්දසිරි,අජන්තා රණසිංහ,Key,ක්ලැසික්,නොමේරූ කෙමදාස,ගමේ කෝපි කඩේ දෙන්නා දෙපැත්තේ දාං අදින්නේ ගැටව් කතා බහට කඩ එළිපත්තේ රංචු ගැහෙන්නේ ගමේ රටේ අහේනියයි ළමයිනේ ඔය පුරසාරම් වැඩකට නෑ ළමයිනේ ගමේ කෝපි කඩේ දෙන්නා දෙපැත්තේ දාං අදින්නේ ගැටව් කතා බහට කඩ එළිපත්තේ රංචු ගැහෙන්නේ අපේ කාලෙ අස්වැද්දූ කුඹුරු ලියදි පාළු වෙලා තල කුරහං අල දෙල් කොස් හේන් පිටින් පාළු වෙලා අම්ම අප්ප මොක මොකවත්කන්න බොන්න දුන් පලියට ලැජ්ජ නැද්ද කාලෙ කන්න ගැටවරයිනි කඩ පිල් යට අතපය හත්තිය තියෙද්දි කම්මැලි කම් මොකද බොලව් මගෙ පුපුවත් පත්තු වෙනව අර ඉපනැලි යාය බලව් වයස ගියත් මගෙ අත පය බලාපල්ල යකඩ වගේ අපි වවලයි අපි කෑවේ උත්තම රජගොල්ලො වගේ,ගමේ කෝපි කඩේ,1128,game kopi kade
604,සනත් නන්දසිරි,අජන්තා රණසිංහ,Key,"නව පොප්, ඉල්ලීම",නිමල් ජයකොඩි,ගංගා ජලේ කින්නරා අංගනා නිල් ගං ජලේ හැංඟුනා ඒ කින්නරා කවුරුදෝ ඔබ විනා මා මන් බැඳී රංජනා ඔබ ඉන්නවානේ පියුමක් රනින් ගංගා ජලාසේ පිපුණා ලෙසින් තෙත්වූ දුහුල් සළුවෙන් එතී ඔය පංච පෙම් කල්‍යාණ රූ මගෙ දෑස ආශාවෙන් බන්දා තියා හිංසා කරන්නේ ඇයි රිදුවා හැඟුම් දිය බේරිලා සැලෙනා ඔබේ වරලේ අහෝ දැවටෙන්න හෝ මට වාසනා නැතිදෝ සඳ කින්නරී දුල්වන් රුවින් පිරිපුන් මන්දෝදරී ගංගා ජලේ කින්නරා අංගනා නිල් ගං ජලේ හැංඟුනා ඒ කින්නරා කවුරුදෝ ඔබ විනා මා මන් බැඳී රංජනා ඔබ ඉන්නවානේ පියුමක් රනින් ගංගා ජලාසේ පිපුණා ලෙසින් රූ ශ්‍රී ඔබේ මව මවා සිත් ලෙනේ මා තවුතිසා රාජ්‍යයේ,ගංගා ජලේ,355,ganga jale
605,"නිරංජල සරෝජිනී, ප්‍රියා සූරියසේන",අජන්තා රණසිංහ,Key,යුගල,ප්‍රියා සූරියසේන,ගෙල වට බැන්දා වූ මුතු පොටේ දිස්නෙට මුහුණේහි ඔප වැටේ ඔසරි නෙරියට නළල් තිලකෙට බැන්ද සිතු පෙම් ආනන්ද වේ කෝකිල සංදේශ කවි පොතේ ඔය වැනි උපමා ද තව ඇතේ රුවැති ළඳකට තනිව මඟ තොට යන්න නිදහස දැන් නෑ වගේ සෙංකඩගලපුර පෝදා හඳ මෙනි මේ මුතුමැණිකේ ලා දළදා සමිඳුන් වැඩ හිඳිනා බිම නෑ සුබ නෑ ඕවා// කාගේ කවුරුද ඉන්නේ කොතැනද නෑ අපි අඳුනන්නේ ආගන්තුක අපි ආවම කඳුරට නැතුවද පිළිගන්නේ//,ගෙල වට බැන්දා වූ,3215,gela wata banda wu
606,ක්ලැරන්ස් විජේවර්ධන,අජන්තා රණසිංහ,F major | Beat,පැරණි පොප්ස්,ක්ලැරන්ස් විජේවර්ධන,හිංදි වදන් මියුරු හඬින් කියන සිතාරා සිංදු නදී ඉවුර දිගේ එන්න සිතාරා// බ්‍රින්දා උයන දිහා චන්දන සිහිල රැඳී භාරත කුසුම මගේ උන්නා සුවඳ දිදී හිංදි වදන් මියුරු හඬින් කියන සිතාරා වරළ පුරා මල් පැළදි ලියේ දිගටි නෙතේ පෙම් කැළුම ප්‍රියේ මතක සිතේ දැන් මතක තියේ පූර්ණිමා... හිනා වෙන්න ළඟින් ඉන්න සකල කළා මල් පිපෙන රටේ ලලිත කළා මල් පොකුර මගේ නුඹට ළඳේ මං බැඳුණු හදේ සුරංගනා... සුරල් නාද ඇසෙයි තාම,හිංදි වදන්,674,hindi wadan
607,අබේවර්ධන බාලසූරිය,අජන්තා රණසිංහ,D minor,පැරණි පොප්ස්,නොමේරූ කෙමදාස,කල්පනා ලොව මල් වනේ සිහින රජදහනේ ආදරේ… ආදරේ නීල අහසේ තාරකාසේ ඈ නුවන් දල්වා බලන්නී ප්‍රේමයේ මායා දැලින් මා සිත් නුවන් බදවා තබන්නී මා වටා සහසක් යුගත් පා ඈ රුවින් පිළිරු මැවිලා පාවයයි මුළු ජීවිතේ සුදු මීදුමින් දැවටී එතීලා,කල්පනා ලොව,1215,kalpana lowa
608,"මිල්ටන් මල්ලවරාච්චි, නීලා වික්‍රමසිංහ",අජන්තා රණසිංහ,A major,"යුගල, චිත්‍රපට ගීත",සරත් දසනායක,කීන දන් මිටක් කඩන් ආවා මගේ නංගෝ කාටවත් නෙවේ නගාටයි මේ ආ නංගෝ පොඩි කාලේ වාගෙ අපේ - ඔන්න ඔට්ටුයි කියාලා හැංගි මුත්තං හොයාලා හැංගෙමුදෝ අයියේ පුංචි හීනේ ගෝනි බිල්ලෝ නංගි අල්ලං යන්න ඒවී මං බය නෑනේ අයියා මා ලඟ ඉන්නේ තුන් යම රෑ පානේ ඉරිඟු යායෙන් කිරල ගාලෙන් කිරි වැදිලා කිරි ගොයමේ නෑ නෑ අයියේ - ඒ පින මේ ගම්මානේ සෝයුරු පිං මහිමේ,කීන දන් මිටක්,845,keena dan mitak
609,දයරත්න රණතුංග,අජන්තා රණසිංහ,Key,පැරණි පොප්ස්,දයරත්න රණතුංග,කිරි කවඩි සිනහ නොදැක බැඳුණු ආදරේ ඔබෙ අහංකාර බැල්මට බැඳි ආදරේ ආදරේ ආදරේ කිරි කවඩි සිනහ නොදැක බැඳුණු ආදරේ// පුළුලු උකුල සිහිනිඟ සුඟ සුනිල උපුල දිගු නෙත් යුග සඳැස් කවක උපමාවක් යොදාලා පෙම් කවක් ලියන්නෙමි පත් ඉරු පුරාලා පෙම් කවක් ලියන්නෙමි පත් ඉරු පුරාලා නැකැත් අරන් මා එනතුරු හෙට කුකුළා හඬළන තුරු ප්‍රේම ගඟේ ගීය හෙමින් ගයාලා අපි යන්න යමුද පෙම් ඔරුවක නැගීලා අපි යන්න යමුද පෙම් ඔරුවක නැගීලා,කිරි කවඩි සිනා,1763,kiri kawadi
610,ක්ලැරන්ස් විජේවර්ධන,අජන්තා රණසිංහ,D minor | Beat,පැරණි පොප්ස්,ක්ලැරන්ස් විජේවර්ධන,කිරි සුදු සේලේ ඇඳි ඇගෙ ලෝලේ ගෙල බැඳි මාලේ ඇගෙ නෙතු දෑලේ පියකරු ලීලේ ඒ එ ආයන්න කියවන්නෙ ඈ මී බින්දු රස දෙන්නෙ ඈ සිත පුංචි රිදවන්නෙ නෑ පංතියේ ඔබෙ පුංචි ඒ පංතියේ ඉඳගන්න සිතෙහි තියේ ඉඩ දෙන්න බැරිදෝ ලියේ පංතියේ,කිරි සුදු සේලේ,1251,kiri sudu sele
611,"සනත් නන්දසිරි, සුජාතා අත්තනායක",අජන්තා රණසිංහ,Key,"යුගල, දේවානුභාවයෙන්",සනත් නන්දසිරි,කොහෝ කොහෝ කොහේ ඉඳන් කොහෝ කියනවදෝ අපේ ගමේ රබන් පදේ උඹට ඇහෙනවදෝ ..// කජු නාඹර රස මී අඹ ගස් යට වැහි වැහැලා කොහෝ අන්න අර බලපන් මී වද පැණි පිරිලා// කොහෝ කොහෝ කොහේ ඉඳන් කොහෝ කියනවදෝ බක් මාසේ මඟුල් නැකැත් මටත් කියනවදෝ// රබන් හඬට බමරු නටන ලස්සණ ගම් මැද්දේ කොහෝ උඹත් ගී කියපන් සිංහල අවුරුද්දේ කොහෝ කොහෝ කොහේ ඉඳන් කොහෝ කියනවදෝ අවුරුද්දට අපේ දිහා නෑගම් එනවදෝ ...//,කොහෝ කොහෝ,698,koho koho
612,"කුෂානි සඳාරෙඛා, මායා දමයන්ති",අජන්තා රණසිංහ,Key,"වත්මන් ගීත, මගේ තේරීම්, පැරණි පොප්ස්",අර්නස්ට් සොයිසා,කුරුල්ලෝ නුඹේ තාලෙන් පියාඹන්න ආසයි පියාපත් කොහේ කොතැනින් කොහෙන්දෝ ගෙනෙන්නේ// කියාපන් කුරුල්ලෝ නෙළුම් මල් නෙලාලා ගෙලේ මං පළන්දා කිණ්ණරාවි රූපෙන් බලන් ඉන්නවා දැං හීන් බණ්ඩි ගොයමේ ගිරා නිල්රටාවේ ඉහල ගම් දිහාවේ ඇඹූල් පේර මාදං පොකුරු බරවෙලා දැං බලන් ඉන්නවාලු සිංදු ගීත වන්නම් ඔහේ කිය කියා යං,කුරුල්ලෝ නුඹේ,3057,kurullo nube thalen
613,චන්ද්‍රලේඛ පෙරෙයිරා,අජන්තා රණසිංහ,Key,නව පොප්,සරත් දසනායක,මගේ දිනපොතේහි අද රෑ ලියන්නේ // අ‍ප පෙම්කතාවේ අවසානයයි ඔබ නේන දා හෙට මා මනමාලියයි මගේ දිනපොතේහි අද රෑ ලියන්නේ කවදාක හෝ..… එක්තැන් වෙලා සුව හා සුසුම් සමසේ දරා අත්වැල් බැඳන් යමු ජීවිතේ ඒ කී වදන් බොල් හීනෙකී පාසැල් සමේ අ‍පි දෙන්නගේ නම් කුරුටු ගෑ කඩදාසි ඒ ගිණි අවුළුවා නටබුන් පෙමින් අපි වෙන්වෙමු දෛවේ ලෙසින්,මගේ දිනපොතේහි,721,mage dina pothehee
614,නීලා වික්‍රමසිංහ,අජන්තා රණසිංහ,Key,පැරණි පොප්ස්,නොමේරූ කෙමදාස,මගේ ලොවට ඔබ වඩින තුරා වඩින තුරා තරුවක් වාගේ හෙටත් නොපායන මගේ යොවුන් හද ප්‍රාර්ථනා අදත් එදා මෙන් බලා හිදී මගේ ලොවට ඔබ වඩින තුරා වඩින තුරා බලා හිඳිමි පෙර මග නෙතු දල්වා ආදරයේ මුතු පියවිලි අතුරා කවදා හෝ එක් අරුණ උදාවක මගේ ලොවට ඔබ වඩින තුරා වඩින තුරා බලා හිඳිමි කඳුලින් නෙතු පොඟවා ආදරයේ රන් කවුළු පියන් හැර වසන්තයේ පණිවුඩය සිතින් ගෙන මගේ ලොවට ඔබ වඩින තුරා වඩින තුරා,මගේ ලොවට ඔබ,431,mage lowata oba
